{
  "id": "maint-ac-002-sys-004-proc-004",
  "title": "Adjustment Procedure for Landing Gear System on Airbus A320",
  "description": "This procedure provides instructions for performing adjustment on the landing gear system of Airbus A320 aircraft.",
  "estimated_time": "1 hour",
  "skill_level": "Technician Level 2",
  "safety_precautions": [
    "Ensure aircraft is properly grounded",
    "Wear appropriate personal protective equipment",
    "Follow all safety protocols in the maintenance manual",
    "Use proper lifting techniques when handling heavy components"
  ],
  "tools_required": [
    {
      "id": "tool-001",
      "name": "Socket Set",
      "specification": "Standard, 10-19mm"
    },
    {
      "id": "tool-002",
      "name": "Torque Wrench",
      "specification": "Calibrated, 5-50 Nm"
    },
    {
      "id": "tool-003",
      "name": "Inspection Mirror",
      "specification": "Telescoping"
    }
  ],
  "parts_required": [
    {
      "id": "part-001",
      "name": "Sensor",
      "part_number": "SN-ac-002-sys-004",
      "quantity": 1
    },
    {
      "id": "part-002",
      "name": "Lubricant",
      "part_number": "LB-ac-002",
      "quantity": 1
    }
  ],
  "steps": [
    {
      "step_number": 1,
      "title": "Preparation",
      "description": "Gather all necessary tools and parts. Ensure aircraft is in a safe state for maintenance.",
      "cautions": [
        "Verify aircraft is properly secured"
      ],
      "images": []
    },
    {
      "step_number": 2,
      "title": "Access Panel Removal",
      "description": "Remove access panel to gain access to the system components.",
      "cautions": [
        "Support panel during removal"
      ],
      "images": []
    },
    {
      "step_number": 3,
      "title": "Component Adjustment",
      "description": "Adjust component settings as specified.",
      "cautions": [
        "Do not exceed specified adjustment limits"
      ],
      "images": []
    },
    {
      "step_number": 4,
      "title": "Testing After Adjustment",
      "description": "Test the system after making adjustments.",
      "cautions": [
        "Verify adjustments are within specifications"
      ],
      "images": []
    },
    {
      "step_number": 5,
      "title": "Reassembly",
      "description": "Reinstall access panel and secure all fasteners.",
      "cautions": [
        "Torque fasteners to specified values"
      ],
      "images": []
    },
    {
      "step_number": 6,
      "title": "Documentation",
      "description": "Complete maintenance records and documentation.",
      "cautions": [
        "Ensure all work is properly documented"
      ],
      "images": []
    }
  ],
  "references": [
    {
      "id": "ref-001",
      "type": "manual",
      "title": "Aircraft Maintenance Manual",
      "section": "Chapter 32 - Landing Gear System"
    },
    {
      "id": "ref-002",
      "type": "service_bulletin",
      "title": "Technical Order TO-ac-002-sys-004",
      "date": "2025-01-15"
    }
  ]
}